"No.","Time","Source","Destination","Protocol","Length","Info"
"1","0.000000000","157.240.195.56","10.0.2.15","TLSv1.2","310","Application Data"
"2","0.043856631","10.0.2.15","157.240.195.56","TCP","54","33254  >  443 [ACK] Seq=1 Ack=257 Win=63542 Len=0"
"3","0.055920862","10.0.2.15","157.240.195.56","TLSv1.2","144","Application Data"
"4","0.056775915","157.240.195.56","10.0.2.15","TCP","60","443  >  33254 [ACK] Seq=257 Ack=91 Win=65535 Len=0"
"5","0.228096549","157.240.195.56","10.0.2.15","TLSv1.2","183","Application Data"
"6","0.228158598","10.0.2.15","157.240.195.56","TCP","54","33254  >  443 [ACK] Seq=91 Ack=386 Win=63542 Len=0"
"7","0.231131475","10.0.2.15","157.240.195.56","TLSv1.2","148","Application Data"
"8","0.231877929","157.240.195.56","10.0.2.15","TCP","60","443  >  33254 [ACK] Seq=386 Ack=185 Win=65535 Len=0"
"23","2.940949466","157.240.195.56","10.0.2.15","TLSv1.2","1483","Application Data"
"24","2.983914135","10.0.2.15","157.240.195.56","TCP","54","33254  >  443 [ACK] Seq=185 Ack=1815 Win=63542 Len=0"
"25","2.993963816","10.0.2.15","157.240.195.56","TLSv1.2","144","Application Data"
"26","2.994735405","157.240.195.56","10.0.2.15","TCP","60","443  >  33254 [ACK] Seq=1815 Ack=275 Win=65535 Len=0"
"27","3.204294512","157.240.195.56","10.0.2.15","TLSv1.2","183","Application Data"
"28","3.204357430","10.0.2.15","157.240.195.56","TCP","54","33254  >  443 [ACK] Seq=275 Ack=1944 Win=63542 Len=0"
"29","3.209172042","10.0.2.15","157.240.195.56","TLSv1.2","148","Application Data"
"30","3.210058943","157.240.195.56","10.0.2.15","TCP","60","443  >  33254 [ACK] Seq=1944 Ack=369 Win=65535 Len=0"
"45","6.835838286","157.240.195.56","10.0.2.15","TCP","1514","443  >  33254 [ACK] Seq=1944 Ack=369 Win=65535 Len=1460 [TCP segment of a reassembled PDU]"
"46","6.881106763","10.0.2.15","157.240.195.56","TCP","54","33254  >  443 [ACK] Seq=369 Ack=3404 Win=63542 Len=0"
"47","6.881641136","157.240.195.56","10.0.2.15","TLSv1.2","157","Application Data, Application Data"
"48","6.881686825","10.0.2.15","157.240.195.56","TCP","54","33254  >  443 [ACK] Seq=369 Ack=3507 Win=63542 Len=0"
"49","6.920072251","10.0.2.15","157.240.195.56","TLSv1.2","144","Application Data"
"50","6.920544669","157.240.195.56","10.0.2.15","TCP","60","443  >  33254 [ACK] Seq=3507 Ack=459 Win=65535 Len=0"
"51","7.098318809","157.240.195.56","10.0.2.15","TLSv1.2","183","Application Data"
"52","7.098361621","10.0.2.15","157.240.195.56","TCP","54","33254  >  443 [ACK] Seq=459 Ack=3636 Win=63542 Len=0"
"53","7.101663016","10.0.2.15","157.240.195.56","TLSv1.2","148","Application Data"
"54","7.102798835","157.240.195.56","10.0.2.15","TCP","60","443  >  33254 [ACK] Seq=3636 Ack=553 Win=65535 Len=0"
"71","10.932348212","10.0.2.15","157.240.195.56","TLSv1.2","123","Application Data"
"72","10.935325944","157.240.195.56","10.0.2.15","TCP","60","443  >  33254 [ACK] Seq=3636 Ack=622 Win=65535 Len=0"
"73","11.072484750","157.240.195.56","10.0.2.15","TLSv1.2","125","Application Data"
"74","11.116866365","10.0.2.15","157.240.195.56","TCP","54","33254  >  443 [ACK] Seq=622 Ack=3707 Win=63542 Len=0"
"75","14.953528395","157.240.195.56","10.0.2.15","TLSv1.2","1323","Application Data"
"76","14.953595791","10.0.2.15","157.240.195.56","TCP","54","33254  >  443 [ACK] Seq=622 Ack=4976 Win=63542 Len=0"
"77","15.027349533","10.0.2.15","157.240.195.56","TLSv1.2","144","Application Data"
"78","15.028121239","157.240.195.56","10.0.2.15","TCP","60","443  >  33254 [ACK] Seq=4976 Ack=712 Win=65535 Len=0"
"79","15.183073806","157.240.195.56","10.0.2.15","TLSv1.2","183","Application Data"
"80","15.183147645","10.0.2.15","157.240.195.56","TCP","54","33254  >  443 [ACK] Seq=712 Ack=5105 Win=63542 Len=0"
"81","15.186598255","10.0.2.15","157.240.195.56","TLSv1.2","148","Application Data"
"82","15.187236703","157.240.195.56","10.0.2.15","TCP","60","443  >  33254 [ACK] Seq=5105 Ack=806 Win=65535 Len=0"
"97","18.407346626","157.240.195.56","10.0.2.15","TLSv1.2","310","Application Data"
"98","18.447794648","10.0.2.15","157.240.195.56","TCP","54","33254  >  443 [ACK] Seq=806 Ack=5361 Win=63542 Len=0"
"99","18.488692647","10.0.2.15","157.240.195.56","TLSv1.2","144","Application Data"
"100","18.489712962","157.240.195.56","10.0.2.15","TCP","60","443  >  33254 [ACK] Seq=5361 Ack=896 Win=65535 Len=0"
"101","18.660090960","157.240.195.56","10.0.2.15","TLSv1.2","183","Application Data"
"102","18.660136925","10.0.2.15","157.240.195.56","TCP","54","33254  >  443 [ACK] Seq=896 Ack=5490 Win=63542 Len=0"
"103","18.662792576","10.0.2.15","157.240.195.56","TLSv1.2","148","Application Data"
"104","18.663826849","157.240.195.56","10.0.2.15","TCP","60","443  >  33254 [ACK] Seq=5490 Ack=990 Win=65535 Len=0"
"120","21.729758260","157.240.195.56","10.0.2.15","TLSv1.2","1499","Application Data"
"121","21.772054124","10.0.2.15","157.240.195.56","TCP","54","33254  >  443 [ACK] Seq=990 Ack=6935 Win=63542 Len=0"
"122","21.783025355","10.0.2.15","157.240.195.56","TLSv1.2","144","Application Data"
"123","21.783568190","157.240.195.56","10.0.2.15","TCP","60","443  >  33254 [ACK] Seq=6935 Ack=1080 Win=65535 Len=0"
"124","22.023558812","157.240.195.56","10.0.2.15","TLSv1.2","183","Application Data"
"125","22.023622075","10.0.2.15","157.240.195.56","TCP","54","33254  >  443 [ACK] Seq=1080 Ack=7064 Win=63542 Len=0"
"126","22.025328860","10.0.2.15","157.240.195.56","TLSv1.2","148","Application Data"
"127","22.025864060","157.240.195.56","10.0.2.15","TCP","60","443  >  33254 [ACK] Seq=7064 Ack=1174 Win=65535 Len=0"
"144","28.259777830","157.240.195.56","10.0.2.15","TCP","1514","443  >  33254 [ACK] Seq=7064 Ack=1174 Win=65535 Len=1460 [TCP segment of a reassembled PDU]"
"145","28.312474883","10.0.2.15","157.240.195.56","TCP","54","33254  >  443 [ACK] Seq=1174 Ack=8524 Win=63542 Len=0"
"146","28.312648463","157.240.195.56","10.0.2.15","TLSv1.2","173","Application Data, Application Data"
"147","28.312727771","10.0.2.15","157.240.195.56","TCP","54","33254  >  443 [ACK] Seq=1174 Ack=8643 Win=63542 Len=0"
"148","28.364926070","10.0.2.15","157.240.195.56","TLSv1.2","144","Application Data"
"149","28.365367118","157.240.195.56","10.0.2.15","TCP","60","443  >  33254 [ACK] Seq=8643 Ack=1264 Win=65535 Len=0"
"150","28.605740388","157.240.195.56","10.0.2.15","TLSv1.2","183","Application Data"
"151","28.605802569","10.0.2.15","157.240.195.56","TCP","54","33254  >  443 [ACK] Seq=1264 Ack=8772 Win=63542 Len=0"
"152","28.608011276","10.0.2.15","157.240.195.56","TLSv1.2","148","Application Data"
"153","28.608368151","157.240.195.56","10.0.2.15","TCP","60","443  >  33254 [ACK] Seq=8772 Ack=1358 Win=65535 Len=0"
"170","32.488891661","10.0.2.15","157.240.195.56","TLSv1.2","123","Application Data"
"171","32.491962178","157.240.195.56","10.0.2.15","TCP","60","443  >  33254 [ACK] Seq=8772 Ack=1427 Win=65535 Len=0"
"172","32.628595958","157.240.195.56","10.0.2.15","TLSv1.2","125","Application Data"
"173","32.679155245","10.0.2.15","157.240.195.56","TCP","54","33254  >  443 [ACK] Seq=1427 Ack=8843 Win=63542 Len=0"
"174","39.247397116","157.240.195.56","10.0.2.15","TLSv1.2","859","Application Data"
"175","39.247466745","10.0.2.15","157.240.195.56","TCP","54","33254  >  443 [ACK] Seq=1427 Ack=9648 Win=63542 Len=0"
"176","39.307291473","10.0.2.15","157.240.195.56","TLSv1.2","144","Application Data"
"177","39.307677141","157.240.195.56","10.0.2.15","TCP","60","443  >  33254 [ACK] Seq=9648 Ack=1517 Win=65535 Len=0"
"178","40.306552327","157.240.195.56","10.0.2.15","TLSv1.2","183","Application Data"
"179","40.306648950","10.0.2.15","157.240.195.56","TCP","54","33254  >  443 [ACK] Seq=1517 Ack=9777 Win=63542 Len=0"
"182","40.338261721","10.0.2.15","157.240.195.56","TLSv1.2","148","Application Data"
"183","40.338898636","157.240.195.56","10.0.2.15","TCP","60","443  >  33254 [ACK] Seq=9777 Ack=1611 Win=65535 Len=0"
"198","45.325432231","157.240.195.56","10.0.2.15","TCP","1514","443  >  33254 [ACK] Seq=9777 Ack=1611 Win=65535 Len=1460 [TCP segment of a reassembled PDU]"
"199","45.373314422","10.0.2.15","157.240.195.56","TCP","54","33254  >  443 [ACK] Seq=1611 Ack=11237 Win=63542 Len=0"
"200","45.373653270","157.240.195.56","10.0.2.15","TLSv1.2","173","Application Data, Application Data"
"201","45.373703531","10.0.2.15","157.240.195.56","TCP","54","33254  >  443 [ACK] Seq=1611 Ack=11356 Win=63542 Len=0"
"202","45.429332971","10.0.2.15","157.240.195.56","TLSv1.2","144","Application Data"
"203","45.430133669","157.240.195.56","10.0.2.15","TCP","60","443  >  33254 [ACK] Seq=11356 Ack=1701 Win=65535 Len=0"
"204","45.594062559","157.240.195.56","10.0.2.15","TLSv1.2","183","Application Data"
"205","45.594156817","10.0.2.15","157.240.195.56","TCP","54","33254  >  443 [ACK] Seq=1701 Ack=11485 Win=63542 Len=0"
"206","45.600547930","10.0.2.15","157.240.195.56","TLSv1.2","148","Application Data"
"207","45.601083903","157.240.195.56","10.0.2.15","TCP","60","443  >  33254 [ACK] Seq=11485 Ack=1795 Win=65535 Len=0"
"221","47.778522677","157.240.195.56","10.0.2.15","TLSv1.2","310","Application Data"
"222","47.823767627","10.0.2.15","157.240.195.56","TCP","54","33254  >  443 [ACK] Seq=1795 Ack=11741 Win=63542 Len=0"
"223","47.841484239","10.0.2.15","157.240.195.56","TLSv1.2","144","Application Data"
"224","47.841935305","157.240.195.56","10.0.2.15","TCP","60","443  >  33254 [ACK] Seq=11741 Ack=1885 Win=65535 Len=0"
"225","48.044776822","157.240.195.56","10.0.2.15","TLSv1.2","183","Application Data"
"226","48.044819298","10.0.2.15","157.240.195.56","TCP","54","33254  >  443 [ACK] Seq=1885 Ack=11870 Win=63542 Len=0"
"227","48.052566918","10.0.2.15","157.240.195.56","TLSv1.2","148","Application Data"
"228","48.055394386","157.240.195.56","10.0.2.15","TCP","60","443  >  33254 [ACK] Seq=11870 Ack=1979 Win=65535 Len=0"
"229","49.338131007","10.0.2.15","157.240.195.56","TLSv1.2","123","Application Data"
"230","49.340931715","157.240.195.56","10.0.2.15","TCP","60","443  >  33254 [ACK] Seq=11870 Ack=2048 Win=65535 Len=0"
"231","49.479972231","157.240.195.56","10.0.2.15","TLSv1.2","125","Application Data"
"232","49.524926743","10.0.2.15","157.240.195.56","TCP","54","33254  >  443 [ACK] Seq=2048 Ack=11941 Win=63542 Len=0"
"247","54.789187547","157.240.195.56","10.0.2.15","TLSv1.2","1323","Application Data"
"248","54.789260490","10.0.2.15","157.240.195.56","TCP","54","33254  >  443 [ACK] Seq=2048 Ack=13210 Win=63542 Len=0"
"249","54.856246752","10.0.2.15","157.240.195.56","TLSv1.2","144","Application Data"
"250","54.856862372","157.240.195.56","10.0.2.15","TCP","60","443  >  33254 [ACK] Seq=13210 Ack=2138 Win=65535 Len=0"
"251","55.131448053","157.240.195.56","10.0.2.15","TLSv1.2","183","Application Data"
"252","55.131481663","10.0.2.15","157.240.195.56","TCP","54","33254  >  443 [ACK] Seq=2138 Ack=13339 Win=63542 Len=0"
"253","55.133365854","10.0.2.15","157.240.195.56","TLSv1.2","148","Application Data"
"254","55.134903667","157.240.195.56","10.0.2.15","TCP","60","443  >  33254 [ACK] Seq=13339 Ack=2232 Win=65535 Len=0"
"268","58.573839046","157.240.195.56","10.0.2.15","TLSv1.2","243","Application Data"
"269","58.611649800","10.0.2.15","157.240.195.56","TLSv1.2","126","Application Data"
"270","58.612760419","157.240.195.56","10.0.2.15","TCP","60","443  >  33254 [ACK] Seq=13528 Ack=2304 Win=65535 Len=0"
"271","60.261019158","157.240.195.56","10.0.2.15","TLSv1.2","314","Application Data"
"272","60.300046422","10.0.2.15","157.240.195.56","TLSv1.2","147","Application Data"
"273","60.300918336","157.240.195.56","10.0.2.15","TCP","60","443  >  33254 [ACK] Seq=13788 Ack=2397 Win=65535 Len=0"
"274","60.650297052","157.240.195.56","10.0.2.15","TLSv1.2","172","Application Data"
"275","60.662011741","10.0.2.15","157.240.195.56","TLSv1.2","148","Application Data"
"276","60.662487653","157.240.195.56","10.0.2.15","TCP","60","443  >  33254 [ACK] Seq=13906 Ack=2491 Win=65535 Len=0"
"277","63.899048399","157.240.195.56","10.0.2.15","TLSv1.2","147","Application Data"
"278","63.903325747","10.0.2.15","157.240.195.56","TLSv1.2","146","Application Data"
"279","63.903969260","157.240.195.56","10.0.2.15","TCP","60","443  >  33254 [ACK] Seq=13999 Ack=2583 Win=65535 Len=0"
"280","71.784519750","157.240.195.56","10.0.2.15","TLSv1.2","443","Application Data"
"281","71.827810019","10.0.2.15","157.240.195.56","TCP","54","33254  >  443 [ACK] Seq=2583 Ack=14388 Win=63542 Len=0"
"282","71.846308731","10.0.2.15","157.240.195.56","TLSv1.2","147","Application Data"
"283","71.846721065","157.240.195.56","10.0.2.15","TCP","60","443  >  33254 [ACK] Seq=14388 Ack=2676 Win=65535 Len=0"
"284","72.184254319","157.240.195.56","10.0.2.15","TLSv1.2","172","Application Data"
"285","72.184285716","10.0.2.15","157.240.195.56","TCP","54","33254  >  443 [ACK] Seq=2676 Ack=14506 Win=63542 Len=0"
"286","72.191531886","10.0.2.15","157.240.195.56","TLSv1.2","148","Application Data"
"287","72.191822550","157.240.195.56","10.0.2.15","TCP","60","443  >  33254 [ACK] Seq=14506 Ack=2770 Win=65535 Len=0"
"288","72.800165789","10.0.2.15","157.240.195.56","TLSv1.2","123","Application Data"
"289","72.800851136","157.240.195.56","10.0.2.15","TCP","60","443  >  33254 [ACK] Seq=14506 Ack=2839 Win=65535 Len=0"
"290","72.940099401","157.240.195.56","10.0.2.15","TLSv1.2","125","Application Data"
"291","72.984220194","10.0.2.15","157.240.195.56","TCP","54","33254  >  443 [ACK] Seq=2839 Ack=14577 Win=63542 Len=0"
"292","75.984436715","157.240.195.56","10.0.2.15","TLSv1.2","147","Application Data"
"293","75.984507883","10.0.2.15","157.240.195.56","TCP","54","33254  >  443 [ACK] Seq=2839 Ack=14670 Win=63542 Len=0"
"294","75.988077101","10.0.2.15","157.240.195.56","TLSv1.2","146","Application Data"
"295","75.988652117","157.240.195.56","10.0.2.15","TCP","60","443  >  33254 [ACK] Seq=14670 Ack=2931 Win=65535 Len=0"
"296","77.108185958","157.240.195.56","10.0.2.15","TCP","1446","443  >  33254 [PSH, ACK] Seq=14670 Ack=2931 Win=65535 Len=1392 [TCP segment of a reassembled PDU]"
"297","77.110332255","157.240.195.56","10.0.2.15","TLSv1.2","175","Application Data"
"298","77.110393513","10.0.2.15","157.240.195.56","TCP","54","33254  >  443 [ACK] Seq=2931 Ack=16183 Win=63542 Len=0"
"301","77.186190726","10.0.2.15","157.240.195.56","TLSv1.2","147","Application Data"
"302","77.186471193","157.240.195.56","10.0.2.15","TCP","60","443  >  33254 [ACK] Seq=16183 Ack=3024 Win=65535 Len=0"
"320","77.396238900","157.240.195.56","10.0.2.15","TLSv1.2","172","Application Data"
"321","77.406623448","10.0.2.15","157.240.195.56","TLSv1.2","148","Application Data"
"323","77.407298668","157.240.195.56","10.0.2.15","TCP","60","443  >  33254 [ACK] Seq=16301 Ack=3118 Win=65535 Len=0"
"516","79.546425470","157.240.195.56","10.0.2.15","TLSv1.2","147","Application Data"
"517","79.549990690","10.0.2.15","157.240.195.56","TLSv1.2","146","Application Data"
"518","79.550877616","157.240.195.56","10.0.2.15","TCP","60","443  >  33254 [ACK] Seq=16394 Ack=3210 Win=65535 Len=0"
"519","82.364982541","157.240.195.56","10.0.2.15","TLSv1.2","617","Application Data"
"520","82.408605286","10.0.2.15","157.240.195.56","TCP","54","33254  >  443 [ACK] Seq=3210 Ack=16957 Win=63542 Len=0"
"521","82.410145139","10.0.2.15","157.240.195.56","TLSv1.2","144","Application Data"
"522","82.410612234","157.240.195.56","10.0.2.15","TCP","60","443  >  33254 [ACK] Seq=16957 Ack=3300 Win=65535 Len=0"
"523","83.429160413","157.240.195.56","10.0.2.15","TLSv1.2","1323","Application Data"
"524","83.429192850","10.0.2.15","157.240.195.56","TCP","54","33254  >  443 [ACK] Seq=3300 Ack=18226 Win=63542 Len=0"
"525","83.429160685","157.240.195.56","10.0.2.15","TCP","1514","443  >  33254 [ACK] Seq=18226 Ack=3300 Win=65535 Len=1460 [TCP segment of a reassembled PDU]"
"526","83.429213937","10.0.2.15","157.240.195.56","TCP","54","33254  >  443 [ACK] Seq=3300 Ack=19686 Win=62780 Len=0"
"527","83.429160720","157.240.195.56","10.0.2.15","TLSv1.2","60","Application Data"
"528","83.429220723","10.0.2.15","157.240.195.56","TCP","54","33254  >  443 [ACK] Seq=3300 Ack=19687 Win=62779 Len=0"
"529","83.539217490","10.0.2.15","157.240.195.56","TLSv1.2","144","Application Data"
"530","83.539985970","157.240.195.56","10.0.2.15","TCP","60","443  >  33254 [ACK] Seq=19687 Ack=3390 Win=65535 Len=0"
"531","83.582982265","10.0.2.15","157.240.195.56","TLSv1.2","144","Application Data"
"532","83.583254259","157.240.195.56","10.0.2.15","TCP","60","443  >  33254 [ACK] Seq=19687 Ack=3480 Win=65535 Len=0"
"533","83.624541295","157.240.195.56","10.0.2.15","TLSv1.2","1649","Application Data, Application Data"
"534","83.624573098","10.0.2.15","157.240.195.56","TCP","54","33254  >  443 [ACK] Seq=3480 Ack=21282 Win=62779 Len=0"
"535","83.650843206","10.0.2.15","157.240.195.56","TLSv1.2","144","Application Data"
"536","83.651241155","157.240.195.56","10.0.2.15","TCP","60","443  >  33254 [ACK] Seq=21282 Ack=3570 Win=65535 Len=0"
"537","83.855069144","157.240.195.56","10.0.2.15","TLSv1.2","859","Application Data"
"538","83.891028669","10.0.2.15","157.240.195.56","TLSv1.2","144","Application Data"
"539","83.891575476","157.240.195.56","10.0.2.15","TCP","60","443  >  33254 [ACK] Seq=22087 Ack=3660 Win=65535 Len=0"
"555","86.734735285","157.240.195.56","10.0.2.15","TLSv1.2","249","Application Data"
"556","86.742369898","10.0.2.15","157.240.195.56","TLSv1.2","148","Application Data"
"557","86.743469685","157.240.195.56","10.0.2.15","TCP","60","443  >  33254 [ACK] Seq=22282 Ack=3754 Win=65535 Len=0"
"558","87.194231724","157.240.195.56","10.0.2.15","TLSv1.2","1765","Application Data, Application Data"
"559","87.194297649","10.0.2.15","157.240.195.56","TCP","54","33254  >  443 [ACK] Seq=3754 Ack=23993 Win=62779 Len=0"
"560","87.228996264","10.0.2.15","157.240.195.56","TLSv1.2","147","Application Data"
"561","87.230309408","157.240.195.56","10.0.2.15","TCP","60","443  >  33254 [ACK] Seq=23993 Ack=3847 Win=65535 Len=0"
"564","87.461694749","157.240.195.56","10.0.2.15","TLSv1.2","172","Application Data"
"565","87.471213124","10.0.2.15","157.240.195.56","TLSv1.2","148","Application Data"
"566","87.471866485","157.240.195.56","10.0.2.15","TCP","60","443  >  33254 [ACK] Seq=24111 Ack=3941 Win=65535 Len=0"
"584","89.882163956","10.0.2.15","157.240.195.56","TLSv1.2","123","Application Data"
"585","89.882729283","157.240.195.56","10.0.2.15","TCP","60","443  >  33254 [ACK] Seq=24111 Ack=4010 Win=65535 Len=0"
"586","90.019115189","157.240.195.56","10.0.2.15","TLSv1.2","125","Application Data"
"587","90.059828076","10.0.2.15","157.240.195.56","TCP","54","33254  >  443 [ACK] Seq=4010 Ack=24182 Win=62779 Len=0"
"588","91.036192601","157.240.195.56","10.0.2.15","TLSv1.2","147","Application Data"
"589","91.036262348","10.0.2.15","157.240.195.56","TCP","54","33254  >  443 [ACK] Seq=4010 Ack=24275 Win=62779 Len=0"
"590","91.039456106","10.0.2.15","157.240.195.56","TLSv1.2","146","Application Data"
"591","91.039967421","157.240.195.56","10.0.2.15","TCP","60","443  >  33254 [ACK] Seq=24275 Ack=4102 Win=65535 Len=0"
"592","92.430119626","10.0.2.15","157.240.195.56","TLSv1.2","3482","Application Data"
"593","92.431173899","157.240.195.56","10.0.2.15","TCP","60","443  >  33254 [ACK] Seq=24275 Ack=5562 Win=65535 Len=0"
"594","92.431174092","157.240.195.56","10.0.2.15","TCP","60","443  >  33254 [ACK] Seq=24275 Ack=7022 Win=65535 Len=0"
"595","92.431174142","157.240.195.56","10.0.2.15","TCP","60","443  >  33254 [ACK] Seq=24275 Ack=7530 Win=65535 Len=0"
"600","92.446963887","10.0.2.15","157.240.195.56","TCP","74","58250  >  443 [SYN] Seq=0 Win=64240 Len=0 MSS=1460 SACK_PERM=1 TSval=1938752937 TSecr=0 WS=128"
"601","92.493541123","157.240.195.56","10.0.2.15","TCP","60","443  >  58250 [SYN, ACK] Seq=0 Ack=1 Win=65535 Len=0 MSS=1460"
"602","92.493661648","10.0.2.15","157.240.195.56","TCP","54","58250  >  443 [ACK] Seq=1 Ack=1 Win=64240 Len=0"
"603","92.493993963","10.0.2.15","157.240.195.56","TLSv1.3","571","Client Hello"
"604","92.495134090","157.240.195.56","10.0.2.15","TCP","60","443  >  58250 [ACK] Seq=1 Ack=518 Win=65535 Len=0"
"605","92.537743798","157.240.195.56","10.0.2.15","TLSv1.3","266","Server Hello, Change Cipher Spec, Application Data"
"606","92.537835311","10.0.2.15","157.240.195.56","TCP","54","58250  >  443 [ACK] Seq=518 Ack=213 Win=64028 Len=0"
"607","92.542252711","10.0.2.15","157.240.195.56","TLSv1.3","118","Change Cipher Spec, Application Data"
"608","92.542471531","10.0.2.15","157.240.195.56","TLSv1.3","152","Application Data"
"609","92.543022117","157.240.195.56","10.0.2.15","TCP","60","443  >  58250 [ACK] Seq=213 Ack=582 Win=65535 Len=0"
"610","92.543114346","157.240.195.56","10.0.2.15","TCP","60","443  >  58250 [ACK] Seq=213 Ack=680 Win=65535 Len=0"
"611","92.543495977","10.0.2.15","157.240.195.56","TLSv1.3","515","Application Data"
"612","92.543562699","10.0.2.15","157.240.195.56","TLSv1.3","920","Application Data"
"613","92.543775364","157.240.195.56","10.0.2.15","TCP","60","443  >  58250 [ACK] Seq=213 Ack=1141 Win=65535 Len=0"
"614","92.543868033","10.0.2.15","157.240.195.56","TLSv1.3","177","Application Data"
"615","92.543968087","10.0.2.15","157.240.195.56","TLSv1.3","920","Application Data"
"616","92.544039096","157.240.195.56","10.0.2.15","TCP","60","443  >  58250 [ACK] Seq=213 Ack=2007 Win=65535 Len=0"
"617","92.544039236","157.240.195.56","10.0.2.15","TCP","60","443  >  58250 [ACK] Seq=213 Ack=2130 Win=65535 Len=0"
"618","92.544123032","157.240.195.56","10.0.2.15","TCP","60","443  >  58250 [ACK] Seq=213 Ack=2996 Win=65535 Len=0"
"619","92.567767614","157.240.195.56","10.0.2.15","TLSv1.2","117","Application Data"
"620","92.585880908","157.240.195.56","10.0.2.15","TLSv1.3","225","Application Data"
"621","92.586347168","157.240.195.56","10.0.2.15","TLSv1.3","128","Application Data"
"622","92.586437935","10.0.2.15","157.240.195.56","TCP","54","58250  >  443 [ACK] Seq=2996 Ack=458 Win=64028 Len=0"
"623","92.586540236","10.0.2.15","157.240.195.56","TLSv1.3","85","Application Data"
"624","92.586720639","157.240.195.56","10.0.2.15","TCP","60","443  >  58250 [ACK] Seq=458 Ack=3027 Win=65535 Len=0"
"625","92.587029528","157.240.195.56","10.0.2.15","TLSv1.3","98","Application Data"
"626","92.588772202","157.240.195.56","10.0.2.15","TLSv1.3","89","Application Data"
"627","92.588894770","10.0.2.15","157.240.195.56","TCP","54","58250  >  443 [ACK] Seq=3027 Ack=537 Win=64028 Len=0"
"628","92.608779151","10.0.2.15","157.240.195.56","TCP","54","33254  >  443 [ACK] Seq=7530 Ack=24338 Win=62779 Len=0"
"629","92.684531807","157.240.195.56","10.0.2.15","TLSv1.3","744","Application Data, Application Data"
"630","92.732399889","10.0.2.15","157.240.195.56","TCP","54","58250  >  443 [ACK] Seq=3027 Ack=1227 Win=64028 Len=0"
"631","94.209611279","157.240.195.56","10.0.2.15","TLSv1.2","601","Application Data"
"632","94.209677833","10.0.2.15","157.240.195.56","TCP","54","33254  >  443 [ACK] Seq=7530 Ack=24885 Win=62779 Len=0"
"633","94.247339222","10.0.2.15","157.240.195.56","TLSv1.2","144","Application Data"
"634","94.247863591","157.240.195.56","10.0.2.15","TCP","60","443  >  33254 [ACK] Seq=24885 Ack=7620 Win=65535 Len=0"
"635","94.402174762","157.240.195.56","10.0.2.15","TLSv1.2","183","Application Data"
"636","94.404477230","10.0.2.15","157.240.195.56","TLSv1.2","148","Application Data"
"637","94.404983652","157.240.195.56","10.0.2.15","TCP","60","443  >  33254 [ACK] Seq=25014 Ack=7714 Win=65535 Len=0"
"638","94.604739138","157.240.195.56","10.0.2.15","TLSv1.2","1323","Application Data"
"639","94.648161167","10.0.2.15","157.240.195.56","TCP","54","33254  >  443 [ACK] Seq=7714 Ack=26283 Win=62779 Len=0"
"640","94.652844992","10.0.2.15","157.240.195.56","TLSv1.2","144","Application Data"
"641","94.653328980","157.240.195.56","10.0.2.15","TCP","60","443  >  33254 [ACK] Seq=26283 Ack=7804 Win=65535 Len=0"
"642","94.819974908","157.240.195.56","10.0.2.15","TLSv1.2","183","Application Data"
"643","94.820034827","10.0.2.15","157.240.195.56","TCP","54","33254  >  443 [ACK] Seq=7804 Ack=26412 Win=62779 Len=0"
"644","94.828435720","10.0.2.15","157.240.195.56","TLSv1.2","148","Application Data"
"645","94.829995246","157.240.195.56","10.0.2.15","TCP","60","443  >  33254 [ACK] Seq=26412 Ack=7898 Win=65535 Len=0"
"646","94.982985596","157.240.195.56","10.0.2.15","TCP","1514","443  >  33254 [ACK] Seq=26412 Ack=7898 Win=65535 Len=1460 [TCP segment of a reassembled PDU]"
"647","94.982985918","157.240.195.56","10.0.2.15","TLSv1.2","60","Application Data"
"648","94.983048258","10.0.2.15","157.240.195.56","TCP","54","33254  >  443 [ACK] Seq=7898 Ack=27873 Win=62779 Len=0"
"649","95.014975130","10.0.2.15","157.240.195.56","TLSv1.2","144","Application Data"
"650","95.015554227","157.240.195.56","10.0.2.15","TCP","60","443  >  33254 [ACK] Seq=27873 Ack=7988 Win=65535 Len=0"
"651","95.214910781","157.240.195.56","10.0.2.15","TLSv1.2","183","Application Data"
"652","95.219830031","10.0.2.15","157.240.195.56","TLSv1.2","148","Application Data"
"653","95.220296699","157.240.195.56","10.0.2.15","TCP","60","443  >  33254 [ACK] Seq=28002 Ack=8082 Win=65535 Len=0"
"654","95.274632282","157.240.195.56","10.0.2.15","TLSv1.2","859","Application Data"
"655","95.301782472","10.0.2.15","157.240.195.56","TLSv1.2","144","Application Data"
"656","95.302203244","157.240.195.56","10.0.2.15","TCP","60","443  >  33254 [ACK] Seq=28807 Ack=8172 Win=65535 Len=0"
"657","95.494393093","157.240.195.56","10.0.2.15","TLSv1.2","183","Application Data"
"658","95.499453020","10.0.2.15","157.240.195.56","TLSv1.2","148","Application Data"
"659","95.499881809","157.240.195.56","10.0.2.15","TCP","60","443  >  33254 [ACK] Seq=28936 Ack=8266 Win=65535 Len=0"
"674","105.702286971","157.240.195.56","10.0.2.15","TLSv1.2","601","Application Data"
"675","105.744186560","10.0.2.15","157.240.195.56","TCP","54","33254  >  443 [ACK] Seq=8266 Ack=29483 Win=62779 Len=0"
"676","105.760056861","10.0.2.15","157.240.195.56","TLSv1.2","144","Application Data"
"677","105.760444319","157.240.195.56","10.0.2.15","TCP","60","443  >  33254 [ACK] Seq=29483 Ack=8356 Win=65535 Len=0"
"678","106.010104206","157.240.195.56","10.0.2.15","TLSv1.2","183","Application Data"
"679","106.010155991","10.0.2.15","157.240.195.56","TCP","54","33254  >  443 [ACK] Seq=8356 Ack=29612 Win=62779 Len=0"
"680","106.012488195","10.0.2.15","157.240.195.56","TLSv1.2","148","Application Data"
"681","106.012949408","157.240.195.56","10.0.2.15","TCP","60","443  >  33254 [ACK] Seq=29612 Ack=8450 Win=65535 Len=0"
"682","106.081379628","157.240.195.56","10.0.2.15","TLSv1.2","1649","Application Data, Application Data"
"683","106.081472181","10.0.2.15","157.240.195.56","TCP","54","33254  >  443 [ACK] Seq=8450 Ack=31207 Win=62779 Len=0"
"684","106.151039241","10.0.2.15","157.240.195.56","TLSv1.2","144","Application Data"
"685","106.151472083","157.240.195.56","10.0.2.15","TCP","60","443  >  33254 [ACK] Seq=31207 Ack=8540 Win=65535 Len=0"
"686","106.302713805","157.240.195.56","10.0.2.15","TLSv1.2","183","Application Data"
"687","106.304409472","10.0.2.15","157.240.195.56","TLSv1.2","148","Application Data"
"688","106.304786870","157.240.195.56","10.0.2.15","TCP","60","443  >  33254 [ACK] Seq=31336 Ack=8634 Win=65535 Len=0"
"689","106.372252879","157.240.195.56","10.0.2.15","TLSv1.2","1323","Application Data"
"690","106.419797157","10.0.2.15","157.240.195.56","TCP","54","33254  >  443 [ACK] Seq=8634 Ack=32605 Win=62779 Len=0"
"691","106.424473134","10.0.2.15","157.240.195.56","TLSv1.2","144","Application Data"
"692","106.424989331","157.240.195.56","10.0.2.15","TCP","60","443  >  33254 [ACK] Seq=32605 Ack=8724 Win=65535 Len=0"
"693","106.581185001","157.240.195.56","10.0.2.15","TLSv1.2","183","Application Data"
"694","106.581252254","10.0.2.15","157.240.195.56","TCP","54","33254  >  443 [ACK] Seq=8724 Ack=32734 Win=62779 Len=0"
"695","106.587443268","10.0.2.15","157.240.195.56","TLSv1.2","148","Application Data"
"696","106.588118565","157.240.195.56","10.0.2.15","TCP","60","443  >  33254 [ACK] Seq=32734 Ack=8818 Win=65535 Len=0"
"697","106.960457699","157.240.195.56","10.0.2.15","TLSv1.2","1499","Application Data"
"698","107.002887039","10.0.2.15","157.240.195.56","TLSv1.2","144","Application Data"
"699","107.003405480","157.240.195.56","10.0.2.15","TCP","60","443  >  33254 [ACK] Seq=34179 Ack=8908 Win=65535 Len=0"
"700","107.218635564","157.240.195.56","10.0.2.15","TLSv1.2","859","Application Data"
"701","107.234517865","157.240.195.56","10.0.2.15","TLSv1.2","183","Application Data"
"702","107.234594017","10.0.2.15","157.240.195.56","TCP","54","33254  >  443 [ACK] Seq=8908 Ack=35113 Win=62779 Len=0"
"703","107.237131419","10.0.2.15","157.240.195.56","TLSv1.2","148","Application Data"
"704","107.237494410","157.240.195.56","10.0.2.15","TCP","60","443  >  33254 [ACK] Seq=35113 Ack=9002 Win=65535 Len=0"
"705","107.254427351","10.0.2.15","157.240.195.56","TLSv1.2","144","Application Data"
"706","107.254780356","157.240.195.56","10.0.2.15","TCP","60","443  >  33254 [ACK] Seq=35113 Ack=9092 Win=65535 Len=0"
"707","107.542002550","157.240.195.56","10.0.2.15","TLSv1.2","183","Application Data"
"708","107.544816515","10.0.2.15","157.240.195.56","TLSv1.2","148","Application Data"
"709","107.545373680","157.240.195.56","10.0.2.15","TCP","60","443  >  33254 [ACK] Seq=35242 Ack=9186 Win=65535 Len=0"
"724","108.137365511","10.0.2.15","157.240.195.56","TLSv1.2","123","Application Data"
"725","108.138323514","157.240.195.56","10.0.2.15","TCP","60","443  >  33254 [ACK] Seq=35242 Ack=9255 Win=65535 Len=0"
"726","108.275009490","157.240.195.56","10.0.2.15","TLSv1.2","125","Application Data"
"727","108.315855042","10.0.2.15","157.240.195.56","TCP","54","33254  >  443 [ACK] Seq=9255 Ack=35313 Win=62779 Len=0"
"728","114.997136395","157.240.195.56","10.0.2.15","TLSv1.2","601","Application Data"
"729","114.997207729","10.0.2.15","157.240.195.56","TCP","54","33254  >  443 [ACK] Seq=9255 Ack=35860 Win=62779 Len=0"
"730","115.055003078","10.0.2.15","157.240.195.56","TLSv1.2","144","Application Data"
"731","115.055407858","157.240.195.56","10.0.2.15","TCP","60","443  >  33254 [ACK] Seq=35860 Ack=9345 Win=65535 Len=0"
"732","115.333148057","157.240.195.56","10.0.2.15","TLSv1.2","183","Application Data"
"733","115.333215239","10.0.2.15","157.240.195.56","TCP","54","33254  >  443 [ACK] Seq=9345 Ack=35989 Win=62779 Len=0"
"734","115.336464442","10.0.2.15","157.240.195.56","TLSv1.2","148","Application Data"
"735","115.337028750","157.240.195.56","10.0.2.15","TCP","60","443  >  33254 [ACK] Seq=35989 Ack=9439 Win=65535 Len=0"
"736","115.426895608","157.240.195.56","10.0.2.15","TLSv1.2","1649","Application Data, Application Data"
"737","115.426942403","10.0.2.15","157.240.195.56","TCP","54","33254  >  443 [ACK] Seq=9439 Ack=37584 Win=62779 Len=0"
"738","115.465271573","10.0.2.15","157.240.195.56","TLSv1.2","144","Application Data"
"739","115.466092432","157.240.195.56","10.0.2.15","TCP","60","443  >  33254 [ACK] Seq=37584 Ack=9529 Win=65535 Len=0"
"740","115.682641544","157.240.195.56","10.0.2.15","TLSv1.2","183","Application Data"
"741","115.684809148","10.0.2.15","157.240.195.56","TLSv1.2","148","Application Data"
"742","115.685668892","157.240.195.56","10.0.2.15","TCP","60","443  >  33254 [ACK] Seq=37713 Ack=9623 Win=65535 Len=0"
"743","115.704555586","157.240.195.56","10.0.2.15","TLSv1.2","1323","Application Data"
"744","115.751756526","10.0.2.15","157.240.195.56","TCP","54","33254  >  443 [ACK] Seq=9623 Ack=38982 Win=62779 Len=0"
"745","115.762065310","10.0.2.15","157.240.195.56","TLSv1.2","144","Application Data"
"746","115.762550740","157.240.195.56","10.0.2.15","TCP","60","443  >  33254 [ACK] Seq=38982 Ack=9713 Win=65535 Len=0"
"747","115.898706909","157.240.195.56","10.0.2.15","TLSv1.2","183","Application Data"
"748","115.898766098","10.0.2.15","157.240.195.56","TCP","54","33254  >  443 [ACK] Seq=9713 Ack=39111 Win=62779 Len=0"
"749","115.912477841","10.0.2.15","157.240.195.56","TLSv1.2","148","Application Data"
"750","115.915211206","157.240.195.56","10.0.2.15","TCP","60","443  >  33254 [ACK] Seq=39111 Ack=9807 Win=65535 Len=0"
"751","116.012195722","157.240.195.56","10.0.2.15","TCP","1514","443  >  33254 [ACK] Seq=39111 Ack=9807 Win=65535 Len=1460 [TCP segment of a reassembled PDU]"
"752","116.012196295","157.240.195.56","10.0.2.15","TLSv1.2","60","Application Data"
"753","116.012230226","10.0.2.15","157.240.195.56","TCP","54","33254  >  443 [ACK] Seq=9807 Ack=40572 Win=62779 Len=0"
"754","116.037972806","10.0.2.15","157.240.195.56","TLSv1.2","144","Application Data"
"755","116.038512726","157.240.195.56","10.0.2.15","TCP","60","443  >  33254 [ACK] Seq=40572 Ack=9897 Win=65535 Len=0"
"756","116.274803710","157.240.195.56","10.0.2.15","TLSv1.2","859","Application Data"
"757","116.309616928","10.0.2.15","157.240.195.56","TLSv1.2","144","Application Data"
"758","116.310280776","157.240.195.56","10.0.2.15","TCP","60","443  >  33254 [ACK] Seq=41377 Ack=9987 Win=65535 Len=0"
"759","116.588255636","157.240.195.56","10.0.2.15","TLSv1.2","183","Application Data"
"760","116.598374570","157.240.195.56","10.0.2.15","TLSv1.2","183","Application Data"
"761","116.598516438","10.0.2.15","157.240.195.56","TCP","54","33254  >  443 [ACK] Seq=9987 Ack=41635 Win=62779 Len=0"
"762","116.598955749","10.0.2.15","157.240.195.56","TLSv1.2","148","Application Data"
"763","116.599176051","157.240.195.56","10.0.2.15","TCP","60","443  >  33254 [ACK] Seq=41635 Ack=10081 Win=65535 Len=0"
"764","116.603648055","10.0.2.15","157.240.195.56","TLSv1.2","148","Application Data"
"765","116.606349950","157.240.195.56","10.0.2.15","TCP","60","443  >  33254 [ACK] Seq=41635 Ack=10175 Win=65535 Len=0"
"769","117.099890230","157.240.195.56","10.0.2.15","TLSv1.2","621","Application Data"
"773","117.147917179","10.0.2.15","157.240.195.56","TCP","54","33254  >  443 [ACK] Seq=10175 Ack=42202 Win=62779 Len=0"
"774","117.149834881","10.0.2.15","157.240.195.56","TLSv1.2","147","Application Data"
"775","117.151806407","157.240.195.56","10.0.2.15","TCP","60","443  >  33254 [ACK] Seq=42202 Ack=10268 Win=65535 Len=0"
"784","117.478277323","157.240.195.56","10.0.2.15","TLSv1.2","172","Application Data"
"785","117.478332821","10.0.2.15","157.240.195.56","TCP","54","33254  >  443 [ACK] Seq=10268 Ack=42320 Win=62779 Len=0"
"786","117.491492893","10.0.2.15","157.240.195.56","TLSv1.2","148","Application Data"
"787","117.492001267","157.240.195.56","10.0.2.15","TCP","60","443  >  33254 [ACK] Seq=42320 Ack=10362 Win=65535 Len=0"
"788","120.646949229","157.240.195.56","10.0.2.15","TLSv1.2","147","Application Data"
"789","120.650714664","10.0.2.15","157.240.195.56","TLSv1.2","146","Application Data"
"790","120.651318730","157.240.195.56","10.0.2.15","TCP","60","443  >  33254 [ACK] Seq=42413 Ack=10454 Win=65535 Len=0"
"791","124.528427666","157.240.195.56","10.0.2.15","TLSv1.2","617","Application Data"
"792","124.572084277","10.0.2.15","157.240.195.56","TCP","54","33254  >  443 [ACK] Seq=10454 Ack=42976 Win=62779 Len=0"
"793","124.593269588","10.0.2.15","157.240.195.56","TLSv1.2","144","Application Data"
"794","124.593651254","157.240.195.56","10.0.2.15","TCP","60","443  >  33254 [ACK] Seq=42976 Ack=10544 Win=65535 Len=0"
"795","125.596788719","157.240.195.56","10.0.2.15","TLSv1.2","183","Application Data"
"796","125.596849917","10.0.2.15","157.240.195.56","TCP","54","33254  >  443 [ACK] Seq=10544 Ack=43105 Win=62779 Len=0"
"797","125.596789442","157.240.195.56","10.0.2.15","TLSv1.2","1649","Application Data, Application Data"
"798","125.597053621","10.0.2.15","157.240.195.56","TCP","54","33254  >  443 [ACK] Seq=10544 Ack=44700 Win=62779 Len=0"
"799","125.596789524","157.240.195.56","10.0.2.15","TLSv1.2","183","Application Data"
"800","125.597078253","10.0.2.15","157.240.195.56","TCP","54","33254  >  443 [ACK] Seq=10544 Ack=44829 Win=62650 Len=0"
"801","125.597836861","157.240.195.56","10.0.2.15","TLSv1.2","1452","Application Data, Application Data"
"802","125.597856578","10.0.2.15","157.240.195.56","TCP","54","33254  >  443 [ACK] Seq=10544 Ack=46227 Win=65535 Len=0"
"803","125.600484718","157.240.195.56","10.0.2.15","TCP","1514","443  >  33254 [ACK] Seq=46227 Ack=10544 Win=65535 Len=1460 [TCP segment of a reassembled PDU]"
"804","125.600494839","10.0.2.15","157.240.195.56","TCP","54","33254  >  443 [ACK] Seq=10544 Ack=47687 Win=65535 Len=0"
"805","125.600484794","157.240.195.56","10.0.2.15","TLSv1.2","60","Application Data"
"806","125.600510735","10.0.2.15","157.240.195.56","TCP","54","33254  >  443 [ACK] Seq=10544 Ack=47688 Win=65535 Len=0"
"807","125.644803419","10.0.2.15","157.240.195.56","TLSv1.2","148","Application Data"
"808","125.644975030","10.0.2.15","157.240.195.56","TLSv1.2","242","Application Data, Application Data"
"809","125.645173276","157.240.195.56","10.0.2.15","TCP","60","443  >  33254 [ACK] Seq=47688 Ack=10638 Win=65535 Len=0"
"810","125.645173363","157.240.195.56","10.0.2.15","TCP","60","443  >  33254 [ACK] Seq=47688 Ack=10826 Win=65535 Len=0"
"811","125.760578512","10.0.2.15","157.240.195.56","TLSv1.2","144","Application Data"
"812","125.761017176","157.240.195.56","10.0.2.15","TCP","60","443  >  33254 [ACK] Seq=47688 Ack=10916 Win=65535 Len=0"
"813","125.800923456","10.0.2.15","157.240.195.56","TLSv1.2","144","Application Data"
"814","125.801540007","157.240.195.56","10.0.2.15","TCP","60","443  >  33254 [ACK] Seq=47688 Ack=11006 Win=65535 Len=0"
"815","125.803248350","157.240.195.56","10.0.2.15","TLSv1.2","183","Application Data"
"816","125.803268822","10.0.2.15","157.240.195.56","TCP","54","33254  >  443 [ACK] Seq=11006 Ack=47817 Win=65535 Len=0"
"817","125.819649695","10.0.2.15","157.240.195.56","TLSv1.2","148","Application Data"
"818","125.820012391","157.240.195.56","10.0.2.15","TCP","60","443  >  33254 [ACK] Seq=47817 Ack=11100 Win=65535 Len=0"
"819","125.841548993","157.240.195.56","10.0.2.15","TLSv1.2","859","Application Data"
"820","125.859242564","10.0.2.15","157.240.195.56","TLSv1.2","144","Application Data"
"821","125.859662908","157.240.195.56","10.0.2.15","TCP","60","443  >  33254 [ACK] Seq=48622 Ack=11190 Win=65535 Len=0"
"822","125.911592632","10.0.2.15","157.240.195.56","TLSv1.2","144","Application Data"
"823","125.911953437","157.240.195.56","10.0.2.15","TCP","60","443  >  33254 [ACK] Seq=48622 Ack=11280 Win=65535 Len=0"
"824","126.042434762","157.240.195.56","10.0.2.15","TLSv1.2","183","Application Data"
"825","126.044675837","10.0.2.15","157.240.195.56","TLSv1.2","148","Application Data"
"826","126.045130423","157.240.195.56","10.0.2.15","TCP","60","443  >  33254 [ACK] Seq=48751 Ack=11374 Win=65535 Len=0"
