"No.","Time","Source","Destination","Protocol","Length","Info"
"1","0.000000000","157.240.196.60","10.0.2.15","TLSv1.2","617","Application Data"
"2","0.000075399","10.0.2.15","157.240.196.60","TCP","54","53210  >  443 [ACK] Seq=1 Ack=564 Win=65535 Len=0"
"3","0.211807380","10.0.2.15","157.240.196.60","TLSv1.2","144","Application Data"
"4","0.212308573","157.240.196.60","10.0.2.15","TCP","60","443  >  53210 [ACK] Seq=564 Ack=91 Win=65535 Len=0"
"7","5.284798131","10.0.2.15","157.240.196.60","TLSv1.2","123","Application Data"
"8","5.287879108","157.240.196.60","10.0.2.15","TCP","60","443  >  53210 [ACK] Seq=564 Ack=160 Win=65535 Len=0"
"9","5.426804735","157.240.196.60","10.0.2.15","TLSv1.2","125","Application Data"
"10","5.426869915","10.0.2.15","157.240.196.60","TCP","54","53210  >  443 [ACK] Seq=160 Ack=635 Win=65535 Len=0"
"11","17.420617178","157.240.196.60","10.0.2.15","TLSv1.2","617","Application Data"
"12","17.420685803","10.0.2.15","157.240.196.60","TCP","54","53210  >  443 [ACK] Seq=160 Ack=1198 Win=65535 Len=0"
"13","17.616487238","10.0.2.15","157.240.196.60","TLSv1.2","144","Application Data"
"14","17.616929827","157.240.196.60","10.0.2.15","TCP","60","443  >  53210 [ACK] Seq=1198 Ack=250 Win=65535 Len=0"
"17","21.717366432","10.0.2.15","157.240.196.60","TLSv1.2","123","Application Data"
"18","21.718156268","157.240.196.60","10.0.2.15","TCP","60","443  >  53210 [ACK] Seq=1198 Ack=319 Win=65535 Len=0"
"19","21.856283396","157.240.196.60","10.0.2.15","TLSv1.2","125","Application Data"
"20","21.856352474","10.0.2.15","157.240.196.60","TCP","54","53210  >  443 [ACK] Seq=319 Ack=1269 Win=65535 Len=0"
"21","33.498395827","157.240.196.60","10.0.2.15","TLSv1.2","617","Application Data"
"22","33.498476903","10.0.2.15","157.240.196.60","TCP","54","53210  >  443 [ACK] Seq=319 Ack=1832 Win=65535 Len=0"
"23","33.701781297","10.0.2.15","157.240.196.60","TLSv1.2","144","Application Data"
"24","33.702128510","157.240.196.60","10.0.2.15","TCP","60","443  >  53210 [ACK] Seq=1832 Ack=409 Win=65535 Len=0"
"25","45.327852800","10.0.2.15","157.240.196.60","TLSv1.2","123","Application Data"
"26","45.328642661","157.240.196.60","10.0.2.15","TCP","60","443  >  53210 [ACK] Seq=1832 Ack=478 Win=65535 Len=0"
"27","45.466220828","157.240.196.60","10.0.2.15","TLSv1.2","125","Application Data"
"28","45.466279552","10.0.2.15","157.240.196.60","TCP","54","53210  >  443 [ACK] Seq=478 Ack=1903 Win=65535 Len=0"
"29","47.219574808","157.240.196.60","10.0.2.15","TLSv1.2","601","Application Data"
"30","47.219647465","10.0.2.15","157.240.196.60","TCP","54","53210  >  443 [ACK] Seq=478 Ack=2450 Win=65535 Len=0"
"31","47.454074318","10.0.2.15","157.240.196.60","TLSv1.2","144","Application Data"
"32","47.454515504","157.240.196.60","10.0.2.15","TCP","60","443  >  53210 [ACK] Seq=2450 Ack=568 Win=65535 Len=0"
"33","61.146674026","157.240.196.60","10.0.2.15","TLSv1.2","601","Application Data"
"34","61.146746919","10.0.2.15","157.240.196.60","TCP","54","53210  >  443 [ACK] Seq=568 Ack=2997 Win=65535 Len=0"
"35","61.345902693","10.0.2.15","157.240.196.60","TLSv1.2","123","Application Data"
"36","61.347264256","157.240.196.60","10.0.2.15","TCP","60","443  >  53210 [ACK] Seq=2997 Ack=637 Win=65535 Len=0"
"37","61.354539429","10.0.2.15","157.240.196.60","TLSv1.2","144","Application Data"
"38","61.355132572","157.240.196.60","10.0.2.15","TCP","60","443  >  53210 [ACK] Seq=2997 Ack=727 Win=65535 Len=0"
"39","61.484967734","157.240.196.60","10.0.2.15","TLSv1.2","125","Application Data"
"40","61.484999285","10.0.2.15","157.240.196.60","TCP","54","53210  >  443 [ACK] Seq=727 Ack=3068 Win=65535 Len=0"
"43","76.200642841","157.240.196.60","10.0.2.15","TLSv1.2","601","Application Data"
"44","76.200724252","10.0.2.15","157.240.196.60","TCP","54","53210  >  443 [ACK] Seq=727 Ack=3615 Win=65535 Len=0"
"45","76.416103243","10.0.2.15","157.240.196.60","TLSv1.2","144","Application Data"
"46","76.416657183","157.240.196.60","10.0.2.15","TCP","60","443  >  53210 [ACK] Seq=3615 Ack=817 Win=65535 Len=0"
"47","79.787846009","10.0.2.15","157.240.196.60","TLSv1.2","123","Application Data"
"48","79.788582845","157.240.196.60","10.0.2.15","TCP","60","443  >  53210 [ACK] Seq=3615 Ack=886 Win=65535 Len=0"
"49","79.925239156","157.240.196.60","10.0.2.15","TLSv1.2","125","Application Data"
"50","79.925307767","10.0.2.15","157.240.196.60","TCP","54","53210  >  443 [ACK] Seq=886 Ack=3686 Win=65535 Len=0"
"51","90.229951499","157.240.196.60","10.0.2.15","TLSv1.2","617","Application Data"
"52","90.230014359","10.0.2.15","157.240.196.60","TCP","54","53210  >  443 [ACK] Seq=886 Ack=4249 Win=65535 Len=0"
"53","90.452141298","10.0.2.15","157.240.196.60","TLSv1.2","144","Application Data"
"54","90.453217238","157.240.196.60","10.0.2.15","TCP","60","443  >  53210 [ACK] Seq=4249 Ack=976 Win=65535 Len=0"
"55","97.805209952","10.0.2.15","157.240.196.60","TLSv1.2","123","Application Data"
"56","97.806070406","157.240.196.60","10.0.2.15","TCP","60","443  >  53210 [ACK] Seq=4249 Ack=1045 Win=65535 Len=0"
"57","97.944531457","157.240.196.60","10.0.2.15","TLSv1.2","125","Application Data"
"58","97.944609382","10.0.2.15","157.240.196.60","TCP","54","53210  >  443 [ACK] Seq=1045 Ack=4320 Win=65535 Len=0"
"61","104.356844261","157.240.196.60","10.0.2.15","TLSv1.2","601","Application Data"
"62","104.356924516","10.0.2.15","157.240.196.60","TCP","54","53210  >  443 [ACK] Seq=1045 Ack=4867 Win=65535 Len=0"
"63","104.597365423","10.0.2.15","157.240.196.60","TLSv1.2","144","Application Data"
"64","104.598059721","157.240.196.60","10.0.2.15","TCP","60","443  >  53210 [ACK] Seq=4867 Ack=1135 Win=65535 Len=0"
"71","113.364107866","10.0.2.15","157.240.196.60","TLSv1.2","123","Application Data"
"72","113.367046238","157.240.196.60","10.0.2.15","TCP","60","443  >  53210 [ACK] Seq=4867 Ack=1204 Win=65535 Len=0"
"73","113.504354718","157.240.196.60","10.0.2.15","TLSv1.2","125","Application Data"
"74","113.504397139","10.0.2.15","157.240.196.60","TCP","54","53210  >  443 [ACK] Seq=1204 Ack=4938 Win=65535 Len=0"
"75","118.186231237","157.240.196.60","10.0.2.15","TLSv1.2","617","Application Data"
"76","118.186305702","10.0.2.15","157.240.196.60","TCP","54","53210  >  443 [ACK] Seq=1204 Ack=5501 Win=65535 Len=0"
"77","118.379978726","10.0.2.15","157.240.196.60","TLSv1.2","144","Application Data"
"78","118.380475493","157.240.196.60","10.0.2.15","TCP","60","443  >  53210 [ACK] Seq=5501 Ack=1294 Win=65535 Len=0"
"79","133.546522230","157.240.196.60","10.0.2.15","TLSv1.2","601","Application Data"
"80","133.546591213","10.0.2.15","157.240.196.60","TCP","54","53210  >  443 [ACK] Seq=1294 Ack=6048 Win=65535 Len=0"
"81","133.780158520","10.0.2.15","157.240.196.60","TLSv1.2","144","Application Data"
"82","133.780571713","157.240.196.60","10.0.2.15","TCP","60","443  >  53210 [ACK] Seq=6048 Ack=1384 Win=65535 Len=0"
"83","136.908571089","10.0.2.15","157.240.196.60","TLSv1.2","123","Application Data"
"84","136.911389614","157.240.196.60","10.0.2.15","TCP","60","443  >  53210 [ACK] Seq=6048 Ack=1453 Win=65535 Len=0"
"85","137.048719495","157.240.196.60","10.0.2.15","TLSv1.2","125","Application Data"
"86","137.048785244","10.0.2.15","157.240.196.60","TCP","54","53210  >  443 [ACK] Seq=1453 Ack=6119 Win=65535 Len=0"
"87","148.190818578","157.240.196.60","10.0.2.15","TLSv1.2","601","Application Data"
"88","148.190873066","10.0.2.15","157.240.196.60","TCP","54","53210  >  443 [ACK] Seq=1453 Ack=6666 Win=65535 Len=0"
"89","148.388068151","10.0.2.15","157.240.196.60","TLSv1.2","144","Application Data"
"90","148.388994593","157.240.196.60","10.0.2.15","TCP","60","443  >  53210 [ACK] Seq=6666 Ack=1543 Win=65535 Len=0"
"93","162.017470617","10.0.2.15","157.240.196.60","TLSv1.2","123","Application Data"
"94","162.020209598","157.240.196.60","10.0.2.15","TCP","60","443  >  53210 [ACK] Seq=6666 Ack=1612 Win=65535 Len=0"
"95","162.157783340","157.240.196.60","10.0.2.15","TLSv1.2","125","Application Data"
"96","162.157833198","10.0.2.15","157.240.196.60","TCP","54","53210  >  443 [ACK] Seq=1612 Ack=6737 Win=65535 Len=0"
"97","163.277773230","157.240.196.60","10.0.2.15","TLSv1.2","601","Application Data"
"98","163.277818033","10.0.2.15","157.240.196.60","TCP","54","53210  >  443 [ACK] Seq=1612 Ack=7284 Win=65535 Len=0"
"99","163.472887516","10.0.2.15","157.240.196.60","TLSv1.2","144","Application Data"
"100","163.473335355","157.240.196.60","10.0.2.15","TCP","60","443  >  53210 [ACK] Seq=7284 Ack=1702 Win=65535 Len=0"
