"No.","Time","Source","Destination","Protocol","Length","Info"
"1","0.000000000","157.240.196.60","10.0.2.15","TCP","1514","443  >  53210 [ACK] Seq=1 Ack=1 Win=65535 Len=1460 [TCP segment of a reassembled PDU]"
"2","0.000040413","10.0.2.15","157.240.196.60","TCP","54","53210  >  443 [ACK] Seq=1 Ack=1461 Win=65535 Len=0"
"3","0.000329144","157.240.196.60","10.0.2.15","TLSv1.2","157","Application Data, Application Data"
"4","0.000344581","10.0.2.15","157.240.196.60","TCP","54","53210  >  443 [ACK] Seq=1 Ack=1564 Win=65535 Len=0"
"5","0.201830272","10.0.2.15","157.240.196.60","TLSv1.2","144","Application Data"
"6","0.202928982","157.240.196.60","10.0.2.15","TCP","60","443  >  53210 [ACK] Seq=1564 Ack=91 Win=65535 Len=0"
"11","12.075272020","10.0.2.15","157.240.196.60","TLSv1.2","123","Application Data"
"12","12.075744335","157.240.196.60","10.0.2.15","TCP","60","443  >  53210 [ACK] Seq=1564 Ack=160 Win=65535 Len=0"
"13","12.212863442","157.240.196.60","10.0.2.15","TLSv1.2","125","Application Data"
"14","12.212895249","10.0.2.15","157.240.196.60","TCP","54","53210  >  443 [ACK] Seq=160 Ack=1635 Win=65535 Len=0"
"17","16.138428197","157.240.196.60","10.0.2.15","TCP","1446","443  >  53210 [PSH, ACK] Seq=1635 Ack=160 Win=65535 Len=1392 [TCP segment of a reassembled PDU]"
"18","16.138526514","10.0.2.15","157.240.196.60","TCP","54","53210  >  443 [ACK] Seq=160 Ack=3027 Win=65535 Len=0"
"19","16.138875701","157.240.196.60","10.0.2.15","TLSv1.2","241","Application Data, Application Data"
"20","16.138925916","10.0.2.15","157.240.196.60","TCP","54","53210  >  443 [ACK] Seq=160 Ack=3214 Win=65535 Len=0"
"21","16.401472939","10.0.2.15","157.240.196.60","TLSv1.2","144","Application Data"
"22","16.402667516","157.240.196.60","10.0.2.15","TCP","60","443  >  53210 [ACK] Seq=3214 Ack=250 Win=65535 Len=0"
"23","27.746627675","10.0.2.15","157.240.196.60","TLSv1.2","123","Application Data"
"24","27.747450400","157.240.196.60","10.0.2.15","TCP","60","443  >  53210 [ACK] Seq=3214 Ack=319 Win=65535 Len=0"
"25","27.884427317","157.240.196.60","10.0.2.15","TLSv1.2","125","Application Data"
"26","27.884469018","10.0.2.15","157.240.196.60","TCP","54","53210  >  443 [ACK] Seq=319 Ack=3285 Win=65535 Len=0"
"27","31.044522890","157.240.196.60","10.0.2.15","TCP","1514","443  >  53210 [ACK] Seq=3285 Ack=319 Win=65535 Len=1460 [TCP segment of a reassembled PDU]"
"28","31.044573317","10.0.2.15","157.240.196.60","TCP","54","53210  >  443 [ACK] Seq=319 Ack=4745 Win=65535 Len=0"
"29","31.044815937","157.240.196.60","10.0.2.15","TLSv1.2","173","Application Data, Application Data"
"30","31.044833346","10.0.2.15","157.240.196.60","TCP","54","53210  >  443 [ACK] Seq=319 Ack=4864 Win=65535 Len=0"
"31","31.256636247","10.0.2.15","157.240.196.60","TLSv1.2","144","Application Data"
"32","31.257069613","157.240.196.60","10.0.2.15","TCP","60","443  >  53210 [ACK] Seq=4864 Ack=409 Win=65535 Len=0"
"33","41.636931705","157.240.196.60","10.0.2.15","TLSv1.2","313","Application Data"
"34","41.637001805","10.0.2.15","157.240.196.60","TCP","54","53210  >  443 [ACK] Seq=409 Ack=5123 Win=65535 Len=0"
"35","41.703223694","10.0.2.15","157.240.196.60","TLSv1.2","153","Application Data"
"36","41.703831919","157.240.196.60","10.0.2.15","TCP","60","443  >  53210 [ACK] Seq=5123 Ack=508 Win=65535 Len=0"
"37","45.120057542","157.240.196.60","10.0.2.15","TCP","1446","443  >  53210 [PSH, ACK] Seq=5123 Ack=508 Win=65535 Len=1392 [TCP segment of a reassembled PDU]"
"38","45.120116802","10.0.2.15","157.240.196.60","TCP","54","53210  >  443 [ACK] Seq=508 Ack=6515 Win=65535 Len=0"
"39","45.120843272","157.240.196.60","10.0.2.15","TLSv1.2","241","Application Data, Application Data"
"40","45.120878908","10.0.2.15","157.240.196.60","TCP","54","53210  >  443 [ACK] Seq=508 Ack=6702 Win=65535 Len=0"
"41","45.317603506","10.0.2.15","157.240.196.60","TLSv1.2","144","Application Data"
"42","45.318479590","157.240.196.60","10.0.2.15","TCP","60","443  >  53210 [ACK] Seq=6702 Ack=598 Win=65535 Len=0"
"43","46.851919025","157.240.196.60","10.0.2.15","TLSv1.2","345","Application Data"
"44","46.851984244","10.0.2.15","157.240.196.60","TCP","54","53210  >  443 [ACK] Seq=598 Ack=6993 Win=65535 Len=0"
"45","46.893879839","10.0.2.15","157.240.196.60","TLSv1.2","153","Application Data"
"46","46.895425259","157.240.196.60","10.0.2.15","TCP","60","443  >  53210 [ACK] Seq=6993 Ack=697 Win=65535 Len=0"
"47","50.281357915","10.0.2.15","157.240.196.60","TLSv1.2","123","Application Data"
"48","50.281801453","157.240.196.60","10.0.2.15","TCP","60","443  >  53210 [ACK] Seq=6993 Ack=766 Win=65535 Len=0"
"49","50.418359456","157.240.196.60","10.0.2.15","TLSv1.2","125","Application Data"
"50","50.418412793","10.0.2.15","157.240.196.60","TCP","54","53210  >  443 [ACK] Seq=766 Ack=7064 Win=65535 Len=0"
"53","62.938594039","157.240.196.60","10.0.2.15","TCP","1446","443  >  53210 [PSH, ACK] Seq=7064 Ack=766 Win=65535 Len=1392 [TCP segment of a reassembled PDU]"
"54","62.938655795","10.0.2.15","157.240.196.60","TCP","54","53210  >  443 [ACK] Seq=766 Ack=8456 Win=65535 Len=0"
"55","62.939311123","157.240.196.60","10.0.2.15","TLSv1.2","241","Application Data, Application Data"
"56","62.939375233","10.0.2.15","157.240.196.60","TCP","54","53210  >  443 [ACK] Seq=766 Ack=8643 Win=65535 Len=0"
"57","63.193033119","10.0.2.15","157.240.196.60","TLSv1.2","144","Application Data"
"58","63.195632092","157.240.196.60","10.0.2.15","TCP","60","443  >  53210 [ACK] Seq=8643 Ack=856 Win=65535 Len=0"
"63","70.489368590","10.0.2.15","157.240.196.60","TLSv1.2","123","Application Data"
"64","70.489937163","157.240.196.60","10.0.2.15","TCP","60","443  >  53210 [ACK] Seq=8643 Ack=925 Win=65535 Len=0"
"65","70.630120209","157.240.196.60","10.0.2.15","TLSv1.2","125","Application Data"
"66","70.630178194","10.0.2.15","157.240.196.60","TCP","54","53210  >  443 [ACK] Seq=925 Ack=8714 Win=65535 Len=0"
"67","75.225373425","157.240.196.60","10.0.2.15","TLSv1.2","175","Application Data"
"68","75.225446594","10.0.2.15","157.240.196.60","TCP","54","53210  >  443 [ACK] Seq=925 Ack=8835 Win=65535 Len=0"
"69","75.225762951","157.240.196.60","10.0.2.15","TLSv1.2","191","Application Data"
"70","75.225783515","10.0.2.15","157.240.196.60","TCP","54","53210  >  443 [ACK] Seq=925 Ack=8972 Win=65535 Len=0"
"71","75.254468628","10.0.2.15","157.240.196.60","TLSv1.2","151","Application Data"
"72","75.255608835","157.240.196.60","10.0.2.15","TCP","60","443  >  53210 [ACK] Seq=8972 Ack=1022 Win=65535 Len=0"
"73","75.257696326","10.0.2.15","157.240.196.60","TLSv1.2","151","Application Data"
"74","75.258022666","157.240.196.60","10.0.2.15","TCP","60","443  >  53210 [ACK] Seq=8972 Ack=1119 Win=65535 Len=0"
"75","79.219235969","157.240.196.60","10.0.2.15","TCP","1446","443  >  53210 [PSH, ACK] Seq=8972 Ack=1119 Win=65535 Len=1392 [TCP segment of a reassembled PDU]"
"76","79.259651497","10.0.2.15","157.240.196.60","TCP","54","53210  >  443 [ACK] Seq=1119 Ack=10364 Win=65535 Len=0"
"77","79.260079829","157.240.196.60","10.0.2.15","TLSv1.2","241","Application Data, Application Data"
"78","79.260129789","10.0.2.15","157.240.196.60","TCP","54","53210  >  443 [ACK] Seq=1119 Ack=10551 Win=65535 Len=0"
"79","79.520482836","10.0.2.15","157.240.196.60","TLSv1.2","144","Application Data"
"80","79.521216184","157.240.196.60","10.0.2.15","TCP","60","443  >  53210 [ACK] Seq=10551 Ack=1209 Win=65535 Len=0"
"81","93.044499387","157.240.196.60","10.0.2.15","TCP","1446","443  >  53210 [PSH, ACK] Seq=10551 Ack=1209 Win=65535 Len=1392 [TCP segment of a reassembled PDU]"
"82","93.044566089","10.0.2.15","157.240.196.60","TCP","54","53210  >  443 [ACK] Seq=1209 Ack=11943 Win=65535 Len=0"
"83","93.045602563","157.240.196.60","10.0.2.15","TLSv1.2","225","Application Data, Application Data"
"84","93.045645285","10.0.2.15","157.240.196.60","TCP","54","53210  >  443 [ACK] Seq=1209 Ack=12114 Win=65535 Len=0"
"85","93.255071003","10.0.2.15","157.240.196.60","TLSv1.2","144","Application Data"
"86","93.255544613","157.240.196.60","10.0.2.15","TCP","60","443  >  53210 [ACK] Seq=12114 Ack=1299 Win=65535 Len=0"
"100","95.625341199","10.0.2.15","157.240.196.60","TLSv1.2","123","Application Data"
"101","95.625986590","157.240.196.60","10.0.2.15","TCP","60","443  >  53210 [ACK] Seq=12114 Ack=1368 Win=65535 Len=0"
"102","95.763718096","157.240.196.60","10.0.2.15","TLSv1.2","125","Application Data"
"103","95.763778295","10.0.2.15","157.240.196.60","TCP","54","53210  >  443 [ACK] Seq=1368 Ack=12185 Win=65535 Len=0"
"106","108.609093539","157.240.196.60","10.0.2.15","TCP","1446","443  >  53210 [PSH, ACK] Seq=12185 Ack=1368 Win=65535 Len=1392 [TCP segment of a reassembled PDU]"
"107","108.609189595","10.0.2.15","157.240.196.60","TCP","54","53210  >  443 [ACK] Seq=1368 Ack=13577 Win=65535 Len=0"
"108","108.609934433","157.240.196.60","10.0.2.15","TLSv1.2","241","Application Data, Application Data"
"109","108.609968956","10.0.2.15","157.240.196.60","TCP","54","53210  >  443 [ACK] Seq=1368 Ack=13764 Win=65535 Len=0"
"110","108.825782119","10.0.2.15","157.240.196.60","TLSv1.2","144","Application Data"
"111","108.826288541","157.240.196.60","10.0.2.15","TCP","60","443  >  53210 [ACK] Seq=13764 Ack=1458 Win=65535 Len=0"
"112","124.072864553","157.240.196.60","10.0.2.15","TCP","1446","443  >  53210 [PSH, ACK] Seq=13764 Ack=1458 Win=65535 Len=1392 [TCP segment of a reassembled PDU]"
"113","124.072933254","10.0.2.15","157.240.196.60","TCP","54","53210  >  443 [ACK] Seq=1458 Ack=15156 Win=65535 Len=0"
"114","124.073625853","157.240.196.60","10.0.2.15","TLSv1.2","241","Application Data, Application Data"
"115","124.073660996","10.0.2.15","157.240.196.60","TCP","54","53210  >  443 [ACK] Seq=1458 Ack=15343 Win=65535 Len=0"
"116","124.308992357","10.0.2.15","157.240.196.60","TLSv1.2","144","Application Data"
"117","124.309492749","157.240.196.60","10.0.2.15","TCP","60","443  >  53210 [ACK] Seq=15343 Ack=1548 Win=65535 Len=0"
"118","124.560142908","10.0.2.15","157.240.196.60","TLSv1.2","123","Application Data"
"119","124.560546559","157.240.196.60","10.0.2.15","TCP","60","443  >  53210 [ACK] Seq=15343 Ack=1617 Win=65535 Len=0"
"120","124.697515468","157.240.196.60","10.0.2.15","TLSv1.2","125","Application Data"
"121","124.697635836","10.0.2.15","157.240.196.60","TCP","54","53210  >  443 [ACK] Seq=1617 Ack=15414 Win=65535 Len=0"
"122","139.319855563","157.240.196.60","10.0.2.15","TCP","1514","443  >  53210 [ACK] Seq=15414 Ack=1617 Win=65535 Len=1460 [TCP segment of a reassembled PDU]"
"123","139.319950920","10.0.2.15","157.240.196.60","TCP","54","53210  >  443 [ACK] Seq=1617 Ack=16874 Win=65535 Len=0"
"124","139.320288096","157.240.196.60","10.0.2.15","TLSv1.2","157","Application Data, Application Data"
"125","139.320305170","10.0.2.15","157.240.196.60","TCP","54","53210  >  443 [ACK] Seq=1617 Ack=16977 Win=65535 Len=0"
"126","139.549771361","10.0.2.15","157.240.196.60","TLSv1.2","144","Application Data"
"127","139.550229876","157.240.196.60","10.0.2.15","TCP","60","443  >  53210 [ACK] Seq=16977 Ack=1707 Win=65535 Len=0"
"128","146.806377449","157.240.196.60","10.0.2.15","TLSv1.2","124","Application Data"
"129","146.806450701","10.0.2.15","157.240.196.60","TCP","54","53210  >  443 [ACK] Seq=1707 Ack=17047 Win=65535 Len=0"
"134","152.224146297","10.0.2.15","157.240.196.60","TLSv1.2","123","Application Data"
"135","152.227162228","157.240.196.60","10.0.2.15","TCP","60","443  >  53210 [ACK] Seq=17047 Ack=1776 Win=65535 Len=0"
"136","152.372216050","157.240.196.60","10.0.2.15","TLSv1.2","125","Application Data"
"137","152.372380915","10.0.2.15","157.240.196.60","TCP","54","53210  >  443 [ACK] Seq=1776 Ack=17118 Win=65535 Len=0"
"138","154.383536051","157.240.196.60","10.0.2.15","TCP","1446","443  >  53210 [PSH, ACK] Seq=17118 Ack=1776 Win=65535 Len=1392 [TCP segment of a reassembled PDU]"
"139","154.383601890","10.0.2.15","157.240.196.60","TCP","54","53210  >  443 [ACK] Seq=1776 Ack=18510 Win=65535 Len=0"
"140","154.384200863","157.240.196.60","10.0.2.15","TLSv1.2","241","Application Data, Application Data"
"141","154.384237495","10.0.2.15","157.240.196.60","TCP","54","53210  >  443 [ACK] Seq=1776 Ack=18697 Win=65535 Len=0"
"142","154.604329348","10.0.2.15","157.240.196.60","TLSv1.2","144","Application Data"
"143","154.604715623","157.240.196.60","10.0.2.15","TCP","60","443  >  53210 [ACK] Seq=18697 Ack=1866 Win=65535 Len=0"
