"No.","Time","Source","Destination","Protocol","Length","Info"
"1","0.000000000","157.240.196.60","10.0.2.15","TLSv1.2","859","Application Data"
"2","0.000067628","10.0.2.15","157.240.196.60","TCP","54","53210  >  443 [ACK] Seq=1 Ack=806 Win=65535 Len=0"
"3","0.176289918","10.0.2.15","157.240.196.60","TLSv1.2","144","Application Data"
"4","0.176823423","157.240.196.60","10.0.2.15","TCP","60","443  >  53210 [ACK] Seq=806 Ack=91 Win=65535 Len=0"
"5","2.149970773","157.240.196.60","10.0.2.15","TLSv1.2","142","Application Data"
"6","2.150038514","10.0.2.15","157.240.196.60","TCP","54","53210  >  443 [ACK] Seq=91 Ack=894 Win=65535 Len=0"
"7","2.155917015","10.0.2.15","157.240.196.60","TLSv1.2","126","Application Data"
"8","2.156710554","157.240.196.60","10.0.2.15","TCP","60","443  >  53210 [ACK] Seq=894 Ack=163 Win=65535 Len=0"
"9","14.778437668","10.0.2.15","157.240.196.60","TLSv1.2","123","Application Data"
"10","14.781375738","157.240.196.60","10.0.2.15","TCP","60","443  >  53210 [ACK] Seq=894 Ack=232 Win=65535 Len=0"
"11","14.918964050","157.240.196.60","10.0.2.15","TLSv1.2","125","Application Data"
"12","14.962083784","10.0.2.15","157.240.196.60","TCP","54","53210  >  443 [ACK] Seq=232 Ack=965 Win=65535 Len=0"
"13","16.281994569","157.240.196.60","10.0.2.15","TLSv1.2","859","Application Data"
"14","16.282059170","10.0.2.15","157.240.196.60","TCP","54","53210  >  443 [ACK] Seq=232 Ack=1770 Win=65535 Len=0"
"15","16.496860211","10.0.2.15","157.240.196.60","TLSv1.2","144","Application Data"
"16","16.497282228","157.240.196.60","10.0.2.15","TCP","60","443  >  53210 [ACK] Seq=1770 Ack=322 Win=65535 Len=0"
"19","32.286963002","157.240.196.60","10.0.2.15","TLSv1.2","859","Application Data"
"20","32.287038138","10.0.2.15","157.240.196.60","TCP","54","53210  >  443 [ACK] Seq=322 Ack=2575 Win=65535 Len=0"
"21","32.548797491","10.0.2.15","157.240.196.60","TLSv1.2","144","Application Data"
"22","32.549357658","157.240.196.60","10.0.2.15","TCP","60","443  >  53210 [ACK] Seq=2575 Ack=412 Win=65535 Len=0"
"23","36.258698106","10.0.2.15","157.240.196.60","TLSv1.2","123","Application Data"
"24","36.261510241","157.240.196.60","10.0.2.15","TCP","60","443  >  53210 [ACK] Seq=2575 Ack=481 Win=65535 Len=0"
"25","36.399534232","157.240.196.60","10.0.2.15","TLSv1.2","125","Application Data"
"26","36.399577533","10.0.2.15","157.240.196.60","TCP","54","53210  >  443 [ACK] Seq=481 Ack=2646 Win=65535 Len=0"
"27","47.719225766","157.240.196.60","10.0.2.15","TLSv1.2","859","Application Data"
"28","47.719296289","10.0.2.15","157.240.196.60","TCP","54","53210  >  443 [ACK] Seq=481 Ack=3451 Win=65535 Len=0"
"29","47.980935886","10.0.2.15","157.240.196.60","TLSv1.2","144","Application Data"
"30","47.981369683","157.240.196.60","10.0.2.15","TCP","60","443  >  53210 [ACK] Seq=3451 Ack=571 Win=65535 Len=0"
"31","56.778559169","157.240.196.60","10.0.2.15","TLSv1.2","159","Application Data"
"32","56.778628920","10.0.2.15","157.240.196.60","TCP","54","53210  >  443 [ACK] Seq=571 Ack=3556 Win=65535 Len=0"
"33","56.787156501","157.240.196.60","10.0.2.15","TLSv1.2","207","Application Data"
"34","56.787183974","10.0.2.15","157.240.196.60","TCP","54","53210  >  443 [ACK] Seq=571 Ack=3709 Win=65535 Len=0"
"35","56.789781439","10.0.2.15","157.240.196.60","TLSv1.2","133","Application Data"
"36","56.790427349","157.240.196.60","10.0.2.15","TCP","60","443  >  53210 [ACK] Seq=3709 Ack=650 Win=65535 Len=0"
"37","56.791065246","10.0.2.15","157.240.196.60","TLSv1.2","132","Application Data"
"38","56.791230287","157.240.196.60","10.0.2.15","TCP","60","443  >  53210 [ACK] Seq=3709 Ack=728 Win=65535 Len=0"
"39","58.826487907","10.0.2.15","157.240.196.60","TLSv1.2","123","Application Data"
"40","58.829716026","157.240.196.60","10.0.2.15","TCP","60","443  >  53210 [ACK] Seq=3709 Ack=797 Win=65535 Len=0"
"41","58.968038368","157.240.196.60","10.0.2.15","TLSv1.2","125","Application Data"
"42","59.010847166","10.0.2.15","157.240.196.60","TCP","54","53210  >  443 [ACK] Seq=797 Ack=3780 Win=65535 Len=0"
"45","64.812463378","157.240.196.60","10.0.2.15","TLSv1.2","859","Application Data"
"46","64.812515632","10.0.2.15","157.240.196.60","TCP","54","53210  >  443 [ACK] Seq=797 Ack=4585 Win=65535 Len=0"
"47","64.987512135","10.0.2.15","157.240.196.60","TLSv1.2","144","Application Data"
"48","64.988582910","157.240.196.60","10.0.2.15","TCP","60","443  >  53210 [ACK] Seq=4585 Ack=887 Win=65535 Len=0"
"62","80.179387396","157.240.196.60","10.0.2.15","TLSv1.2","683","Application Data"
"63","80.179492623","10.0.2.15","157.240.196.60","TCP","54","53210  >  443 [ACK] Seq=887 Ack=5214 Win=65535 Len=0"
"64","80.283452930","10.0.2.15","157.240.196.60","TLSv1.2","147","Application Data"
"65","80.283941321","157.240.196.60","10.0.2.15","TCP","60","443  >  53210 [ACK] Seq=5214 Ack=980 Win=65535 Len=0"
"66","80.560967210","157.240.196.60","10.0.2.15","TLSv1.2","859","Application Data"
"67","80.561015749","10.0.2.15","157.240.196.60","TCP","54","53210  >  443 [ACK] Seq=980 Ack=6019 Win=65535 Len=0"
"68","80.750457141","10.0.2.15","157.240.196.60","TLSv1.2","144","Application Data"
"69","80.754177750","157.240.196.60","10.0.2.15","TCP","60","443  >  53210 [ACK] Seq=6019 Ack=1070 Win=65535 Len=0"
"70","82.299833138","10.0.2.15","157.240.196.60","TLSv1.2","123","Application Data"
"71","82.300496305","157.240.196.60","10.0.2.15","TCP","60","443  >  53210 [ACK] Seq=6019 Ack=1139 Win=65535 Len=0"
"72","82.437039128","157.240.196.60","10.0.2.15","TLSv1.2","125","Application Data"
"73","82.437099809","10.0.2.15","157.240.196.60","TCP","54","53210  >  443 [ACK] Seq=1139 Ack=6090 Win=65535 Len=0"
"74","94.815297262","157.240.196.60","10.0.2.15","TLSv1.2","859","Application Data"
"75","94.815362304","10.0.2.15","157.240.196.60","TCP","54","53210  >  443 [ACK] Seq=1139 Ack=6895 Win=65535 Len=0"
"76","95.001083471","10.0.2.15","157.240.196.60","TLSv1.2","144","Application Data"
"77","95.002861857","157.240.196.60","10.0.2.15","TCP","60","443  >  53210 [ACK] Seq=6895 Ack=1229 Win=65535 Len=0"
"82","105.201778481","10.0.2.15","157.240.196.60","TLSv1.2","123","Application Data"
"83","105.204896911","157.240.196.60","10.0.2.15","TCP","60","443  >  53210 [ACK] Seq=6895 Ack=1298 Win=65535 Len=0"
"84","105.342023825","157.240.196.60","10.0.2.15","TLSv1.2","125","Application Data"
"85","105.342078769","10.0.2.15","157.240.196.60","TCP","54","53210  >  443 [ACK] Seq=1298 Ack=6966 Win=65535 Len=0"
"88","111.404533110","157.240.196.60","10.0.2.15","TLSv1.2","859","Application Data"
"89","111.404601254","10.0.2.15","157.240.196.60","TCP","54","53210  >  443 [ACK] Seq=1298 Ack=7771 Win=65535 Len=0"
"90","111.601005968","10.0.2.15","157.240.196.60","TLSv1.2","144","Application Data"
"91","111.601495158","157.240.196.60","10.0.2.15","TCP","60","443  >  53210 [ACK] Seq=7771 Ack=1388 Win=65535 Len=0"
"92","120.465465168","10.0.2.15","157.240.196.60","TLSv1.2","123","Application Data"
"93","120.468674813","157.240.196.60","10.0.2.15","TCP","60","443  >  53210 [ACK] Seq=7771 Ack=1457 Win=65535 Len=0"
"94","120.607012931","157.240.196.60","10.0.2.15","TLSv1.2","125","Application Data"
"95","120.607051411","10.0.2.15","157.240.196.60","TCP","54","53210  >  443 [ACK] Seq=1457 Ack=7842 Win=65535 Len=0"
"96","128.095903623","157.240.196.60","10.0.2.15","TLSv1.2","859","Application Data"
"97","128.095965606","10.0.2.15","157.240.196.60","TCP","54","53210  >  443 [ACK] Seq=1457 Ack=8647 Win=65535 Len=0"
"98","128.289287323","10.0.2.15","157.240.196.60","TLSv1.2","144","Application Data"
"99","128.293313495","157.240.196.60","10.0.2.15","TCP","60","443  >  53210 [ACK] Seq=8647 Ack=1547 Win=65535 Len=0"
"100","133.950068942","157.240.196.60","10.0.2.15","TLSv1.2","328","Application Data"
"101","133.950139012","10.0.2.15","157.240.196.60","TCP","54","53210  >  443 [ACK] Seq=1547 Ack=8921 Win=65535 Len=0"
"102","134.002909029","10.0.2.15","157.240.196.60","TLSv1.2","126","Application Data"
"103","134.003311664","157.240.196.60","10.0.2.15","TCP","60","443  >  53210 [ACK] Seq=8921 Ack=1619 Win=65535 Len=0"
"104","138.325371870","10.0.2.15","157.240.196.60","TLSv1.2","1938","Application Data"
"105","138.326064769","157.240.196.60","10.0.2.15","TCP","60","443  >  53210 [ACK] Seq=8921 Ack=3079 Win=65535 Len=0"
"106","138.326064860","157.240.196.60","10.0.2.15","TCP","60","443  >  53210 [ACK] Seq=8921 Ack=3503 Win=65535 Len=0"
"107","138.463113066","157.240.196.60","10.0.2.15","TLSv1.2","117","Application Data"
"108","138.463149061","10.0.2.15","157.240.196.60","TCP","54","53210  >  443 [ACK] Seq=3503 Ack=8984 Win=65535 Len=0"
"109","139.612547909","157.240.196.60","10.0.2.15","TLSv1.2","330","Application Data"
"110","139.612587927","10.0.2.15","157.240.196.60","TCP","54","53210  >  443 [ACK] Seq=3503 Ack=9260 Win=65535 Len=0"
"111","139.619973970","10.0.2.15","157.240.196.60","TLSv1.2","125","Application Data"
"112","139.620392723","157.240.196.60","10.0.2.15","TCP","60","443  >  53210 [ACK] Seq=9260 Ack=3574 Win=65535 Len=0"
"113","146.693411502","157.240.196.60","10.0.2.15","TLSv1.2","859","Application Data"
"114","146.740838486","10.0.2.15","157.240.196.60","TCP","54","53210  >  443 [ACK] Seq=3574 Ack=10065 Win=65535 Len=0"
"115","146.909582923","10.0.2.15","157.240.196.60","TLSv1.2","144","Application Data"
"116","146.910178407","157.240.196.60","10.0.2.15","TCP","60","443  >  53210 [ACK] Seq=10065 Ack=3664 Win=65535 Len=0"
"119","154.489236146","10.0.2.15","157.240.196.60","TLSv1.2","123","Application Data"
"120","154.492462104","157.240.196.60","10.0.2.15","TCP","60","443  >  53210 [ACK] Seq=10065 Ack=3733 Win=65535 Len=0"
"121","154.630467314","157.240.196.60","10.0.2.15","TLSv1.2","125","Application Data"
"122","154.630523730","10.0.2.15","157.240.196.60","TCP","54","53210  >  443 [ACK] Seq=3733 Ack=10136 Win=65535 Len=0"
"123","159.329589592","157.240.196.60","10.0.2.15","TLSv1.2","331","Application Data"
"124","159.329655369","10.0.2.15","157.240.196.60","TCP","54","53210  >  443 [ACK] Seq=3733 Ack=10413 Win=65535 Len=0"
"125","159.341740447","10.0.2.15","157.240.196.60","TLSv1.2","126","Application Data"
"126","159.342168796","157.240.196.60","10.0.2.15","TCP","60","443  >  53210 [ACK] Seq=10413 Ack=3805 Win=65535 Len=0"
"127","162.196466463","157.240.196.60","10.0.2.15","TLSv1.2","859","Application Data"
"128","162.237196201","10.0.2.15","157.240.196.60","TCP","54","53210  >  443 [ACK] Seq=3805 Ack=11218 Win=65535 Len=0"
"129","162.386350258","10.0.2.15","157.240.196.60","TLSv1.2","144","Application Data"
"130","162.387827525","157.240.196.60","10.0.2.15","TCP","60","443  >  53210 [ACK] Seq=11218 Ack=3895 Win=65535 Len=0"
